{
  "id": "A125_P2_flow",
  "version": "3.2",
  "page_title": {
    "title": "客用出口の戸の開き方向",
    "target_subject": "屋外への出口の戸",
    "description": "劇場等の客用に供する屋外への出口の戸の開き方向を判定する"
  },
  "legal_ref": {
    "law_id": "325CO0000000338",
    "law_type": "order",
    "law_name": "建築基準法施行令",
    "law_abbrev": "令",
    "article": "125",
    "paragraph": "2",
    "item": null
  },
  "labels": [
    "単体規定",
    "避難規定",
    "出口"
  ],
  "text_raw": "劇場、映画館、演芸場、観覧場、公会堂又は集会場の客用に供する屋外への出口の戸は、内開きとしてはならない。",
  "compliance_logic": {
    "scope_condition": {
      "operator": "AND",
      "conditions": [
        {
          "type": "use",
          "value": "劇場、映画館、演芸場、観覧場、公会堂又は集会場"
        }
      ],
      "note": "建築物の用途が劇場、映画館、演芸場、観覧場、公会堂又は集会場である場合に適用"
    },
    "judgment_rule": {
      "operator": "FORALL",
      "conditions": [
        {
          "ref": "info-door-compliance",
          "operator": "==",
          "value": true
        }
      ]
    },
    "exceptions": null
  },
  "flow_diagram": {
    "title": "令125条2項 客用出口の戸の開き方向 適合判定フロー",
    "description": "劇場等の客用に供する屋外への出口の戸が内開きでないことを判定するフロー",
    "nodes": [
      {
        "id": "start",
        "type": "terminal",
        "title": "判定開始",
        "result": "start",
        "description": "令125条2項の適合判定を開始"
      },
      {
        "id": "dec-use",
        "type": "decision",
        "title": "建築物の用途は？",
        "decision_type": "multi",
        "options": [
          { "value": "劇場", "description": "劇場" },
          { "value": "映画館", "description": "映画館" },
          { "value": "演芸場", "description": "演芸場" },
          { "value": "観覧場", "description": "観覧場" },
          { "value": "公会堂", "description": "公会堂" },
          { "value": "集会場", "description": "集会場" },
          { "value": "その他", "description": "上記以外の用途" }
        ],
        "description": "設計図書等から建築物の用途を確認"
      },
      {
        "id": "proc-identify-doors",
        "type": "process",
        "title": "屋外への出口の戸を特定",
        "process_type": "undefined_input",
        "description": "建築物に属する屋外への出口の戸を特定する"
      },
      {
        "id": "dec-doors-exist",
        "type": "decision",
        "title": "屋外への出口の戸があるか？",
        "decision_type": "binary",
        "description": "建築物に屋外への出口の戸が存在するか確認"
      },
      {
        "id": "proc-select-door",
        "type": "process",
        "title": "未判定の出口の戸を選択",
        "process_type": "mechanical",
        "description": "まだ判定していない出口の戸を1つ選択する"
      },
      {
        "id": "dec-guest-use",
        "type": "decision",
        "title": "客用に供する戸か？",
        "decision_type": "binary",
        "description": "当該出口の戸が客用に供するものか確認"
      },
      {
        "id": "dec-opening-direction",
        "type": "decision",
        "title": "戸の開き方向は？",
        "decision_type": "multi",
        "options": [
          { "value": "内開き", "description": "内開き" },
          { "value": "外開き", "description": "外開き" },
          { "value": "引戸等", "description": "引戸、折戸等" }
        ],
        "description": "当該出口の戸の開き方向を確認"
      },
      {
        "id": "dec-more-doors",
        "type": "decision",
        "title": "未判定の出口の戸があるか？",
        "decision_type": "binary",
        "description": "まだ判定していない出口の戸が残っているか確認"
      },
      {
        "id": "end-not-applicable",
        "type": "terminal",
        "title": "適用対象外",
        "result": "pass",
        "description": "対象用途でないため本条項は適用対象外"
      },
      {
        "id": "end-pass",
        "type": "terminal",
        "title": "適合",
        "result": "pass",
        "description": "全ての客用出口の戸が内開きでないため適合"
      },
      {
        "id": "end-fail",
        "type": "terminal",
        "title": "不適合",
        "result": "fail",
        "description": "客用に供する屋外への出口の戸が内開きであるため不適合"
      }
    ],
    "edges": [
      {
        "id": "e01",
        "from": "start",
        "to": "dec-use",
        "role": "flow"
      },
      {
        "id": "e02",
        "from": "dec-use",
        "to": "proc-identify-doors",
        "role": "option",
        "label": "劇場"
      },
      {
        "id": "e03",
        "from": "dec-use",
        "to": "proc-identify-doors",
        "role": "option",
        "label": "映画館"
      },
      {
        "id": "e04",
        "from": "dec-use",
        "to": "proc-identify-doors",
        "role": "option",
        "label": "演芸場"
      },
      {
        "id": "e05",
        "from": "dec-use",
        "to": "proc-identify-doors",
        "role": "option",
        "label": "観覧場"
      },
      {
        "id": "e06",
        "from": "dec-use",
        "to": "proc-identify-doors",
        "role": "option",
        "label": "公会堂"
      },
      {
        "id": "e07",
        "from": "dec-use",
        "to": "proc-identify-doors",
        "role": "option",
        "label": "集会場"
      },
      {
        "id": "e08",
        "from": "dec-use",
        "to": "end-not-applicable",
        "role": "option",
        "label": "その他"
      },
      {
        "id": "e09",
        "from": "proc-identify-doors",
        "to": "dec-doors-exist",
        "role": "flow"
      },
      {
        "id": "e10",
        "from": "dec-doors-exist",
        "to": "proc-select-door",
        "role": "yes"
      },
      {
        "id": "e11",
        "from": "dec-doors-exist",
        "to": "end-pass",
        "role": "no"
      },
      {
        "id": "e12",
        "from": "proc-select-door",
        "to": "dec-guest-use",
        "role": "flow"
      },
      {
        "id": "e13",
        "from": "dec-guest-use",
        "to": "dec-opening-direction",
        "role": "yes"
      },
      {
        "id": "e14",
        "from": "dec-guest-use",
        "to": "dec-more-doors",
        "role": "no"
      },
      {
        "id": "e15",
        "from": "dec-opening-direction",
        "to": "end-fail",
        "role": "option",
        "label": "内開き"
      },
      {
        "id": "e16",
        "from": "dec-opening-direction",
        "to": "dec-more-doors",
        "role": "option",
        "label": "外開き"
      },
      {
        "id": "e17",
        "from": "dec-opening-direction",
        "to": "dec-more-doors",
        "role": "option",
        "label": "引戸等"
      },
      {
        "id": "e18",
        "from": "dec-more-doors",
        "to": "proc-select-door",
        "role": "yes"
      },
      {
        "id": "e19",
        "from": "dec-more-doors",
        "to": "end-pass",
        "role": "no"
      }
    ]
  },
  "kijo_diagram_ref": "CHK-BSL-ORDER-A125-P2",
  "related_laws": [
    {
      "law_id": "325AC0000000201",
      "law_name": "建築基準法",
      "law_type": "act",
      "relationship": "delegated_from",
      "articles": [
        "A35_P1"
      ],
      "description": "法第35条の避難施設等に関する規定に基づく施行令の委任規定"
    }
  ],
  "metadata": {
    "created_at": "2026-01-26T12:00:00Z",
    "author": "Claude Code",
    "generator": "flow-generator-v1",
    "law_id": "325CO0000000338",
    "law_name": "建築基準法施行令"
  }
}
