{
  "id": "A112_P19_I1_flow",
  "version": "3.2",
  "page_title": {
    "title": "面積区画等の防火設備構造要件（適合判定フロー）",
    "target_subject": "防火設備",
    "description": "第1項本文、第4項、第5項、第7項の区画に用いる防火設備の構造要件"
  },
  "legal_ref": {
    "law_id": "325CO0000000338",
    "law_type": "order",
    "law_name": "建築基準法施行令",
    "law_abbrev": "令",
    "article": "112",
    "paragraph": "19",
    "item": "1"
  },
  "labels": ["単体規定", "防火区画", "防火設備"],
  "flow_diagram": {
    "title": "令112条19項1号 防火設備構造要件適合判定フロー",
    "description": "面積区画等に用いる防火設備のイ・ロ・ハ・ニ要件の適合を判定",
    "nodes": [
      {
        "id": "start",
        "type": "terminal",
        "title": "開始",
        "result": "start",
        "description": "令112条19項1号の適合判定を開始"
      },
      {
        "id": "dec-closure-state",
        "type": "decision",
        "title": "閉鎖・作動状態は？",
        "decision_type": "multi",
        "options": [
          { "value": "常時閉鎖・作動", "description": "常時閉鎖式又は常時作動式" },
          { "value": "随時閉鎖・作動", "description": "随時閉鎖式又は随時作動式" },
          { "value": "その他", "description": "上記以外" }
        ],
        "description": "防火設備が常時閉鎖・作動又は随時閉鎖・作動のいずれか判定（イ要件）"
      },
      {
        "id": "proc-i-comply",
        "type": "process",
        "title": "イ要件適合",
        "process_type": "mechanical",
        "description": "閉鎖・作動状態の要件を満たす"
      },
      {
        "id": "dec-safety",
        "type": "decision",
        "title": "閉鎖・作動時に周囲の人の安全を確保できるか？",
        "decision_type": "binary",
        "description": "閉鎖又は作動時に周囲の人の安全を確保できる構造か判定（ロ要件）"
      },
      {
        "id": "proc-ro-comply",
        "type": "process",
        "title": "ロ要件適合",
        "process_type": "mechanical",
        "description": "安全確保要件を満たす"
      },
      {
        "id": "dec-location",
        "type": "decision",
        "title": "主たる通路の通行部分に設けられているか？",
        "decision_type": "binary",
        "description": "防火設備が居室から地上に通ずる主たる廊下等の通行部分に設けられているか判定"
      },
      {
        "id": "dec-evacuation",
        "type": "decision",
        "title": "閉鎖・作動時に避難上支障がないか？",
        "decision_type": "binary",
        "description": "閉鎖又は作動時に避難上支障がない構造か判定（ハ要件）"
      },
      {
        "id": "proc-ha-comply",
        "type": "process",
        "title": "ハ要件適合",
        "process_type": "mechanical",
        "description": "避難支障要件を満たす（通路部分に設置の場合）"
      },
      {
        "id": "proc-ha-not-applicable",
        "type": "process",
        "title": "ハ要件対象外",
        "process_type": "mechanical",
        "description": "通路部分以外の設置のためハ要件対象外"
      },
      {
        "id": "dec-auto-closure",
        "type": "decision",
        "title": "自動閉鎖機能を有するか？",
        "decision_type": "binary",
        "description": "煙感知又は温度上昇で自動的に閉鎖する構造か判定（ニ要件・随時閉鎖式の場合）"
      },
      {
        "id": "proc-ni-comply",
        "type": "process",
        "title": "ニ要件適合",
        "process_type": "mechanical",
        "description": "自動閉鎖要件を満たす"
      },
      {
        "id": "proc-ni-not-applicable",
        "type": "process",
        "title": "ニ要件対象外",
        "process_type": "mechanical",
        "description": "常時閉鎖式のためニ要件対象外"
      },
      {
        "id": "proc-all-comply",
        "type": "process",
        "title": "全要件適合",
        "process_type": "mechanical",
        "description": "イ・ロ・ハ・ニ全要件を満たす"
      },
      {
        "id": "pass",
        "type": "terminal",
        "title": "適合",
        "result": "pass",
        "description": "令112条19項1号の規定に適合"
      },
      {
        "id": "fail",
        "type": "terminal",
        "title": "不適合",
        "result": "fail",
        "description": "令112条19項1号の規定に不適合"
      }
    ],
    "edges": [
      { "id": "e01", "from": "start", "to": "dec-closure-state", "role": "flow" },
      { "id": "e02", "from": "dec-closure-state", "to": "proc-i-comply", "role": "option", "label": "常時閉鎖・作動" },
      { "id": "e03", "from": "dec-closure-state", "to": "proc-i-comply", "role": "option", "label": "随時閉鎖・作動" },
      { "id": "e04", "from": "dec-closure-state", "to": "fail", "role": "option", "label": "その他" },
      { "id": "e05", "from": "proc-i-comply", "to": "dec-safety", "role": "flow" },
      { "id": "e06", "from": "dec-safety", "to": "proc-ro-comply", "role": "yes", "label": "はい" },
      { "id": "e07", "from": "dec-safety", "to": "fail", "role": "no", "label": "いいえ" },
      { "id": "e08", "from": "proc-ro-comply", "to": "dec-location", "role": "flow" },
      { "id": "e09", "from": "dec-location", "to": "dec-evacuation", "role": "yes", "label": "はい" },
      { "id": "e10", "from": "dec-location", "to": "proc-ha-not-applicable", "role": "no", "label": "いいえ" },
      { "id": "e11", "from": "dec-evacuation", "to": "proc-ha-comply", "role": "yes", "label": "はい" },
      { "id": "e12", "from": "dec-evacuation", "to": "fail", "role": "no", "label": "いいえ" },
      { "id": "e13", "from": "proc-ha-comply", "to": "dec-auto-closure", "role": "flow" },
      { "id": "e14", "from": "proc-ha-not-applicable", "to": "dec-auto-closure", "role": "flow" },
      { "id": "e15", "from": "dec-auto-closure", "to": "proc-ni-comply", "role": "yes", "label": "はい" },
      { "id": "e16", "from": "dec-auto-closure", "to": "proc-ni-not-applicable", "role": "no", "label": "いいえ（常時閉鎖）" },
      { "id": "e17", "from": "proc-ni-comply", "to": "proc-all-comply", "role": "flow" },
      { "id": "e18", "from": "proc-ni-not-applicable", "to": "proc-all-comply", "role": "flow" },
      { "id": "e19", "from": "proc-all-comply", "to": "pass", "role": "flow" }
    ]
  },
  "kijo_diagram_ref": "CHK-BSL-ORD-A112-P19-I1",
  "metadata": {
    "created_at": "2025-12-25T00:00:00+09:00",
    "author": "Claude Code",
    "generator": "flow-generator-v1",
    "law_id": "325CO0000000338",
    "law_name": "建築基準法施行令"
  }
}
