{
  "id": "A112_P13_flow",
  "version": "3.2",
  "page_title": {
    "title": "竪穴区画（小規模三階建特殊建築物）適合判定フロー",
    "target_subject": "竪穴部分",
    "description": "三階を法別表第一（い）欄（二）項の用途（病院等除く）に供する階数三・延べ面積200平方メートル未満の建築物の竪穴区画適合判定"
  },
  "legal_ref": {
    "law_id": "325CO0000000338",
    "law_type": "order",
    "law_name": "建築基準法施行令",
    "law_abbrev": "令",
    "article": "112",
    "paragraph": "13",
    "item": null
  },
  "labels": [
    "単体規定",
    "防火区画",
    "竪穴区画"
  ],
  "kijo_diagram_ref": "CHK-BSL-ORD-A112-P13",
  "flow_diagram": {
    "title": "令第112条第13項適合判定フロー",
    "description": "小規模三階建特殊建築物の竪穴区画要件の適合判定",
    "nodes": [
      {
        "id": "start",
        "type": "terminal",
        "title": "判定開始",
        "result": "start"
      },
      {
        "id": "dec-3f-use",
        "type": "decision",
        "title": "三階の用途は法別表第一（い）欄（二）項か？",
        "decision_type": "binary",
        "description": "三階が病院、診療所（患者の収容施設があるもの）、ホテル、旅館、下宿、共同住宅、寄宿舎等の用途に該当するか（病院等は第12項で判定）"
      },
      {
        "id": "dec-stories",
        "type": "decision",
        "title": "建築物の階数は3か？",
        "decision_type": "binary",
        "description": "当該建築物の階数が3であるか"
      },
      {
        "id": "dec-area",
        "type": "decision",
        "title": "延べ面積は200平方メートル未満か？",
        "decision_type": "binary",
        "description": "当該建築物の延べ面積が200平方メートル未満であるか"
      },
      {
        "id": "proc-scope-applicable",
        "type": "process",
        "title": "本項適用対象",
        "description": "第13項の適用対象建築物に該当"
      },
      {
        "id": "proc-not-applicable",
        "type": "process",
        "title": "本項適用対象外",
        "description": "第13項の適用対象建築物に非該当"
      },
      {
        "id": "dec-shaft-exist",
        "type": "decision",
        "title": "竪穴部分があるか？",
        "decision_type": "binary",
        "description": "建築物に竪穴部分（吹抜き、階段室、昇降機昇降路等）があるか"
      },
      {
        "id": "dec-partition-type",
        "type": "decision",
        "title": "竪穴部分の区画方法は？",
        "decision_type": "multi",
        "options": [
          { "value": "間仕切壁＋戸" },
          { "value": "防火設備" },
          { "value": "区画なし" },
          { "value": "その他" }
        ],
        "description": "竪穴部分と他の部分との区画方法を確認"
      },
      {
        "id": "dec-wall-structure",
        "type": "decision",
        "title": "間仕切壁は準耐火構造か？",
        "decision_type": "binary",
        "description": "竪穴部分を区画する間仕切壁が準耐火構造であるか"
      },
      {
        "id": "dec-door-type",
        "type": "decision",
        "title": "戸は法第2条第9号の2ロの防火設備か？",
        "decision_type": "binary",
        "description": "竪穴部分に設ける戸が法第2条第9号の2ロに規定する防火設備（遮炎性能を有するもの）に該当するか"
      },
      {
        "id": "proc-partition-compliant",
        "type": "process",
        "title": "区画適合",
        "description": "当該竪穴部分の区画が要件に適合"
      },
      {
        "id": "dec-all-shaft-checked",
        "type": "decision",
        "title": "全ての竪穴部分を確認したか？",
        "decision_type": "binary",
        "description": "建築物内の全ての竪穴部分について区画を確認したか"
      },
      {
        "id": "pass",
        "type": "terminal",
        "title": "適合",
        "result": "pass",
        "description": "令第112条第13項に適合"
      },
      {
        "id": "fail",
        "type": "terminal",
        "title": "不適合",
        "result": "fail",
        "description": "令第112条第13項に不適合"
      },
      {
        "id": "pass-not-applicable",
        "type": "terminal",
        "title": "適用除外",
        "result": "pass",
        "description": "本項の適用対象外のため判定不要"
      }
    ],
    "edges": [
      {
        "id": "e01",
        "from": "start",
        "to": "dec-3f-use",
        "role": "flow"
      },
      {
        "id": "e02",
        "from": "dec-3f-use",
        "to": "dec-stories",
        "role": "yes",
        "label": "はい"
      },
      {
        "id": "e03",
        "from": "dec-3f-use",
        "to": "proc-not-applicable",
        "role": "no",
        "label": "いいえ"
      },
      {
        "id": "e04",
        "from": "dec-stories",
        "to": "dec-area",
        "role": "yes",
        "label": "はい"
      },
      {
        "id": "e05",
        "from": "dec-stories",
        "to": "proc-not-applicable",
        "role": "no",
        "label": "いいえ"
      },
      {
        "id": "e06",
        "from": "dec-area",
        "to": "proc-scope-applicable",
        "role": "yes",
        "label": "はい"
      },
      {
        "id": "e07",
        "from": "dec-area",
        "to": "proc-not-applicable",
        "role": "no",
        "label": "いいえ"
      },
      {
        "id": "e08",
        "from": "proc-not-applicable",
        "to": "pass-not-applicable",
        "role": "flow"
      },
      {
        "id": "e09",
        "from": "proc-scope-applicable",
        "to": "dec-shaft-exist",
        "role": "flow"
      },
      {
        "id": "e10",
        "from": "dec-shaft-exist",
        "to": "dec-partition-type",
        "role": "yes",
        "label": "はい"
      },
      {
        "id": "e11",
        "from": "dec-shaft-exist",
        "to": "pass",
        "role": "no",
        "label": "いいえ"
      },
      {
        "id": "e12",
        "from": "dec-partition-type",
        "to": "dec-wall-structure",
        "role": "option",
        "label": "間仕切壁＋戸"
      },
      {
        "id": "e13",
        "from": "dec-partition-type",
        "to": "fail",
        "role": "option",
        "label": "区画なし"
      },
      {
        "id": "e14",
        "from": "dec-partition-type",
        "to": "fail",
        "role": "option",
        "label": "その他"
      },
      {
        "id": "e15",
        "from": "dec-partition-type",
        "to": "dec-door-type",
        "role": "option",
        "label": "防火設備"
      },
      {
        "id": "e16",
        "from": "dec-wall-structure",
        "to": "dec-door-type",
        "role": "yes",
        "label": "はい"
      },
      {
        "id": "e17",
        "from": "dec-wall-structure",
        "to": "fail",
        "role": "no",
        "label": "いいえ"
      },
      {
        "id": "e18",
        "from": "dec-door-type",
        "to": "proc-partition-compliant",
        "role": "yes",
        "label": "はい"
      },
      {
        "id": "e19",
        "from": "dec-door-type",
        "to": "fail",
        "role": "no",
        "label": "いいえ"
      },
      {
        "id": "e20",
        "from": "proc-partition-compliant",
        "to": "dec-all-shaft-checked",
        "role": "flow"
      },
      {
        "id": "e21",
        "from": "dec-all-shaft-checked",
        "to": "pass",
        "role": "yes",
        "label": "はい"
      },
      {
        "id": "e22",
        "from": "dec-all-shaft-checked",
        "to": "dec-partition-type",
        "role": "no",
        "label": "いいえ"
      }
    ]
  },
  "metadata": {
    "created_at": "2025-12-25T00:00:00+09:00",
    "author": "Claude",
    "generator": "flow-generator-v1",
    "law_id": "325CO0000000338",
    "law_name": "建築基準法施行令"
  }
}
