{
  "id": "A114_P3_I4_flow",
  "version": "3.2",
  "page_title": {
    "title": "小屋裏隔壁の適用除外（農業用建築物）",
    "target_subject": "畜舎等",
    "description": "農業上の利用に供される周辺地域にある畜舎等で大臣基準に適合するものは小屋裏隔壁の設置を要しない"
  },
  "legal_ref": {
    "law_id": "325CO0000000338",
    "law_type": "order",
    "law_name": "建築基準法施行令",
    "law_abbrev": "令",
    "article": "114",
    "paragraph": "3",
    "item": "4"
  },
  "labels": [
    "単体規定",
    "防火",
    "小屋裏隔壁",
    "適用除外",
    "農業用建築物",
    "畜舎"
  ],
  "kijo_diagram_ref": "CHK-BSL-ORD-A114-P3-I4",
  "flow_diagram": {
    "title": "令第114条第3項第4号 小屋裏隔壁適用除外（農業用建築物）フロー",
    "description": "農業上の利用に供される周辺地域にある畜舎等で大臣基準に適合し、小屋裏隔壁の設置義務が除外されるか判定",
    "nodes": [
      {
        "id": "start",
        "type": "terminal",
        "title": "判定開始",
        "result": "start"
      },
      {
        "id": "dec-use",
        "type": "decision",
        "title": "建築物の用途は？",
        "decision_type": "multi",
        "options": [
          { "value": "畜舎" },
          { "value": "堆肥舎" },
          { "value": "水産物増殖場の上家" },
          { "value": "水産物養殖場の上家" },
          { "value": "その他" }
        ],
        "description": "畜舎、堆肥舎、水産物の増殖場又は養殖場の上家のいずれかに該当するか"
      },
      {
        "id": "proc-target-use",
        "type": "process",
        "title": "対象用途該当",
        "description": "畜舎、堆肥舎、水産物の増殖場又は養殖場の上家のいずれかに該当"
      },
      {
        "id": "dec-surrounding-agri",
        "type": "decision",
        "title": "周辺地域が農業上の利用又は同様の状況か？",
        "decision_type": "binary",
        "description": "周辺地域が農業上の利用に供され、又はこれと同様の状況にあるか"
      },
      {
        "id": "dec-minister-standard",
        "type": "decision",
        "title": "構造・用途・周囲の状況が大臣基準を満たすか？",
        "decision_type": "binary",
        "description": "構造及び用途並びに周囲の状況に関し避難上及び延焼防止上支障がないものとして国土交通大臣が定める基準に適合するか"
      },
      {
        "id": "proc-item4-applicable",
        "type": "process",
        "title": "第4号該当",
        "description": "令第114条第3項第4号（小屋裏隔壁適用除外）に該当"
      },
      {
        "id": "pass",
        "type": "terminal",
        "title": "適合（第4号該当）",
        "result": "pass",
        "description": "大臣基準に適合し、小屋裏隔壁の設置義務が除外される"
      },
      {
        "id": "fail",
        "type": "terminal",
        "title": "不適合（第4号非該当）",
        "result": "fail",
        "description": "第4号の要件を満たさず、適用除外を受けられない"
      }
    ],
    "edges": [
      {
        "id": "e01",
        "from": "start",
        "to": "dec-use",
        "role": "flow"
      },
      {
        "id": "e02",
        "from": "dec-use",
        "to": "proc-target-use",
        "role": "option",
        "label": "畜舎"
      },
      {
        "id": "e03",
        "from": "dec-use",
        "to": "proc-target-use",
        "role": "option",
        "label": "堆肥舎"
      },
      {
        "id": "e04",
        "from": "dec-use",
        "to": "proc-target-use",
        "role": "option",
        "label": "水産物増殖場の上家"
      },
      {
        "id": "e05",
        "from": "dec-use",
        "to": "proc-target-use",
        "role": "option",
        "label": "水産物養殖場の上家"
      },
      {
        "id": "e06",
        "from": "dec-use",
        "to": "fail",
        "role": "option",
        "label": "その他"
      },
      {
        "id": "e07",
        "from": "proc-target-use",
        "to": "dec-surrounding-agri",
        "role": "flow"
      },
      {
        "id": "e08",
        "from": "dec-surrounding-agri",
        "to": "dec-minister-standard",
        "role": "yes",
        "label": "はい"
      },
      {
        "id": "e09",
        "from": "dec-surrounding-agri",
        "to": "fail",
        "role": "no",
        "label": "いいえ"
      },
      {
        "id": "e10",
        "from": "dec-minister-standard",
        "to": "proc-item4-applicable",
        "role": "yes",
        "label": "はい"
      },
      {
        "id": "e11",
        "from": "dec-minister-standard",
        "to": "fail",
        "role": "no",
        "label": "いいえ"
      },
      {
        "id": "e12",
        "from": "proc-item4-applicable",
        "to": "pass",
        "role": "flow"
      }
    ]
  },
  "related_laws": [
    {
      "law_id": "notice",
      "law_name": "国土交通大臣が定める基準（告示）",
      "law_type": "notice",
      "relationship": "delegates_to",
      "description": "避難上及び延焼防止上支障がないものとして国土交通大臣が定める基準"
    }
  ],
  "metadata": {
    "created_at": "2025-12-25T00:00:00Z",
    "author": "Claude Code",
    "generator": "flow-generator-v1",
    "law_id": "325CO0000000338",
    "law_name": "建築基準法施行令"
  }
}
